<?xml version="1.0"?>
<garderia xmlns:xsi="http://www.w3.org/2001/XMLSchema-instance"
 xsi:noNamespaceSchemaLocation="UD4_T3a_EloyRodalPerez.xsd">
  <neno numeroExpedente="323">
    <nome>Pedro</nome>
    <dataNacemento>2019-12-6</dataNacemento>
    <peso>21</peso>
    <altura>50</altura>
    <vacuna>true</vacuna>
    <sexo>H</sexo>
    <contacto parentesco="nai">999999999</contacto>
    <contacto parentesco="pai">999999999</contacto>
  </neno>
</garderia>